{
  "schema": "wpno.level1.audit_registry/1",
  "build_id": "L1BUILD-R3-2026-08-19-823680e9bb94",
  "build_revision": "R3",
  "mode": "GENERATED_UNVERIFIED",
  "generated": "2026-08-19",
  "project_root": "..",
  "discovery_root": "../08.18.26_Discovery",
  "level1_root": ".",
  "root_note": "The three roots are recorded in the same relative form paths.json uses and are resolved against the directory holding this package. No user name is hardcoded. automation/path_policy.py performs the resolution once.",
  "predecessor_note": "Revision R3. Two predecessor packages failed independent pre-freeze verification: 08.18.26_Level1_Audits (R1, VERIFICATION_FAIL, findings VF-001 to VF-011) and 08.18.26_Level1_Audits_R2 (R2, VERIFICATION_FAIL, two remaining blockers PV-001 build-time Git HEAD and PV-002 Unicode NFC/NFD self-test). The 35-audit contract, IDs, execution order and replication set are preserved unchanged from R2; verification outputs, build history and freeze state are not inherited.",
  "id_scheme_note": "L1-Axx is used instead of AP-xx because the audited project already uses AP identifiers (AP-01..AP-18) for its own work packages. Reusing them would make every cross-reference ambiguous.",
  "source_note": "source_group and source_point are derived by this build. source_point is the ordinal 1..35 of the audit in the originating 35-point specification, in the order that specification states them. source_group is a thematic grouping introduced by this build to make consolidation tractable; it is not present in the originating specification and is recorded here as derived, not found.",
  "execution_order_note": "Fixed, risk-based, and identical to the predecessor package. The controller must not reorder. Order 1..35 is unique.",
  "audits": [
    {
      "audit_id": "L1-A31",
      "source_group": "G9_SIGNATURE_FORENSICS",
      "source_group_title": "Signature, container and copy forensics",
      "source_point": 31,
      "title": "Full certificate-chain verification without -noverify",
      "risk": "CRITICAL",
      "execution_order": 1,
      "replications": 2,
      "prompt_file": "prompts/L1-A31.md",
      "binding_file": "bindings/L1-A31.binding.json",
      "status": "NOT_STARTED"
    },
    {
      "audit_id": "L1-A34",
      "source_group": "G9_SIGNATURE_FORENSICS",
      "source_group_title": "Signature, container and copy forensics",
      "source_point": 34,
      "title": "Full independent verification of vhn.xml.p7s",
      "risk": "CRITICAL",
      "execution_order": 2,
      "replications": 2,
      "prompt_file": "prompts/L1-A34.md",
      "binding_file": "bindings/L1-A34.binding.json",
      "status": "NOT_STARTED"
    },
    {
      "audit_id": "L1-A18",
      "source_group": "G6_VALIDATORS",
      "source_group_title": "Check-digit validators inside the payload scanner",
      "source_point": 18,
      "title": "IBAN Mod-97 correctness",
      "risk": "CRITICAL",
      "execution_order": 3,
      "replications": 2,
      "prompt_file": "prompts/L1-A18.md",
      "binding_file": "bindings/L1-A18.binding.json",
      "status": "NOT_STARTED"
    },
    {
      "audit_id": "L1-A19",
      "source_group": "G6_VALIDATORS",
      "source_group_title": "Check-digit validators inside the payload scanner",
      "source_point": 19,
      "title": "ISO 7064 tax-ID check-digit correctness",
      "risk": "CRITICAL",
      "execution_order": 4,
      "replications": 2,
      "prompt_file": "prompts/L1-A19.md",
      "binding_file": "bindings/L1-A19.binding.json",
      "status": "NOT_STARTED"
    },
    {
      "audit_id": "L1-A17",
      "source_group": "G5_INPUT_FILTER",
      "source_group_title": "Input filter production path",
      "source_point": 17,
      "title": "Production invocation path of the input filter",
      "risk": "CRITICAL",
      "execution_order": 5,
      "replications": 1,
      "prompt_file": "prompts/L1-A17.md",
      "binding_file": "bindings/L1-A17.binding.json",
      "status": "NOT_STARTED"
    },
    {
      "audit_id": "L1-A20",
      "source_group": "G7_PAYLOAD_SCAN",
      "source_group_title": "Payload scanner copies, container provenance, golden test",
      "source_point": 20,
      "title": "All discovered payload_scan copies and semantic equality",
      "risk": "CRITICAL",
      "execution_order": 6,
      "replications": 1,
      "prompt_file": "prompts/L1-A20.md",
      "binding_file": "bindings/L1-A20.binding.json",
      "status": "NOT_STARTED"
    },
    {
      "audit_id": "L1-A21",
      "source_group": "G7_PAYLOAD_SCAN",
      "source_group_title": "Payload scanner copies, container provenance, golden test",
      "source_point": 21,
      "title": "Docker productive copy and image provenance",
      "risk": "CRITICAL",
      "execution_order": 7,
      "replications": 1,
      "prompt_file": "prompts/L1-A21.md",
      "binding_file": "bindings/L1-A21.binding.json",
      "status": "NOT_STARTED"
    },
    {
      "audit_id": "L1-A22",
      "source_group": "G7_PAYLOAD_SCAN",
      "source_group_title": "Payload scanner copies, container provenance, golden test",
      "source_point": 22,
      "title": "Pytest golden-test collection failure and expected result if collected",
      "risk": "CRITICAL",
      "execution_order": 8,
      "replications": 1,
      "prompt_file": "prompts/L1-A22.md",
      "binding_file": "bindings/L1-A22.binding.json",
      "status": "NOT_STARTED"
    },
    {
      "audit_id": "L1-A05",
      "source_group": "G2_OUTPUT_GUARD",
      "source_group_title": "Output guardrail (AP17)",
      "source_point": 5,
      "title": "Output guard catches the known-bad report",
      "risk": "CRITICAL",
      "execution_order": 9,
      "replications": 1,
      "prompt_file": "prompts/L1-A05.md",
      "binding_file": "bindings/L1-A05.binding.json",
      "status": "NOT_STARTED"
    },
    {
      "audit_id": "L1-A06",
      "source_group": "G2_OUTPUT_GUARD",
      "source_group_title": "Output guardrail (AP17)",
      "source_point": 6,
      "title": "Output guard permits the known-good report",
      "risk": "CRITICAL",
      "execution_order": 10,
      "replications": 1,
      "prompt_file": "prompts/L1-A06.md",
      "binding_file": "bindings/L1-A06.binding.json",
      "status": "NOT_STARTED"
    },
    {
      "audit_id": "L1-A07",
      "source_group": "G2_OUTPUT_GUARD",
      "source_group_title": "Output guardrail (AP17)",
      "source_point": 7,
      "title": "Output-guard regression from v1 to v3",
      "risk": "CRITICAL",
      "execution_order": 11,
      "replications": 1,
      "prompt_file": "prompts/L1-A07.md",
      "binding_file": "bindings/L1-A07.binding.json",
      "status": "NOT_STARTED"
    },
    {
      "audit_id": "L1-A08",
      "source_group": "G2_OUTPUT_GUARD",
      "source_group_title": "Output guardrail (AP17)",
      "source_point": 8,
      "title": "Five independently designed output-guard edge cases",
      "risk": "HIGH",
      "execution_order": 12,
      "replications": 1,
      "prompt_file": "prompts/L1-A08.md",
      "binding_file": "bindings/L1-A08.binding.json",
      "status": "NOT_STARTED"
    },
    {
      "audit_id": "L1-A09",
      "source_group": "G2_OUTPUT_GUARD",
      "source_group_title": "Output guardrail (AP17)",
      "source_point": 9,
      "title": "Word-boundary handling across the full pattern set",
      "risk": "HIGH",
      "execution_order": 13,
      "replications": 1,
      "prompt_file": "prompts/L1-A09.md",
      "binding_file": "bindings/L1-A09.binding.json",
      "status": "NOT_STARTED"
    },
    {
      "audit_id": "L1-A10",
      "source_group": "G3_REFERENCE_CHECKER",
      "source_group_title": "Citation and reference checker (AP18)",
      "source_point": 10,
      "title": "Productive reference-checker copy and SHA-256",
      "risk": "HIGH",
      "execution_order": 14,
      "replications": 1,
      "prompt_file": "prompts/L1-A10.md",
      "binding_file": "bindings/L1-A10.binding.json",
      "status": "NOT_STARTED"
    },
    {
      "audit_id": "L1-A11",
      "source_group": "G3_REFERENCE_CHECKER",
      "source_group_title": "Citation and reference checker (AP18)",
      "source_point": 11,
      "title": "BGH_REGISTER completeness versus an independent official roster",
      "risk": "HIGH",
      "execution_order": 15,
      "replications": 1,
      "prompt_file": "prompts/L1-A11.md",
      "binding_file": "bindings/L1-A11.binding.json",
      "status": "NOT_STARTED"
    },
    {
      "audit_id": "L1-A12",
      "source_group": "G3_REFERENCE_CHECKER",
      "source_group_title": "Citation and reference checker (AP18)",
      "source_point": 12,
      "title": "Broad-pattern false positives on a real article corpus",
      "risk": "HIGH",
      "execution_order": 16,
      "replications": 1,
      "prompt_file": "prompts/L1-A12.md",
      "binding_file": "bindings/L1-A12.binding.json",
      "status": "NOT_STARTED"
    },
    {
      "audit_id": "L1-A13",
      "source_group": "G3_REFERENCE_CHECKER",
      "source_group_title": "Citation and reference checker (AP18)",
      "source_point": 13,
      "title": "Fabricated citation blocking",
      "risk": "CRITICAL",
      "execution_order": 17,
      "replications": 1,
      "prompt_file": "prompts/L1-A13.md",
      "binding_file": "bindings/L1-A13.binding.json",
      "status": "NOT_STARTED"
    },
    {
      "audit_id": "L1-A14",
      "source_group": "G3_REFERENCE_CHECKER",
      "source_group_title": "Citation and reference checker (AP18)",
      "source_point": 14,
      "title": "davon BGH N accuracy on the real 43-citation document",
      "risk": "CRITICAL",
      "execution_order": 18,
      "replications": 1,
      "prompt_file": "prompts/L1-A14.md",
      "binding_file": "bindings/L1-A14.binding.json",
      "status": "NOT_STARTED"
    },
    {
      "audit_id": "L1-A15",
      "source_group": "G4_INJECTION_TESTS",